{
  "date": "2026-08-07",
  "target": "脱敏示例目标",
  "stage": "强化阶段",
  "subject_progress": {
    "数学": "用户原话：完成两章",
    "专业课": "用户原话：刚开始第二轮"
  },
  "study_state": "用户原话：最近容易疲劳，但仍能完成复盘",
  "main_problems": ["用户原话：专业课回忆证据不足"],
  "constraints": ["用户原话：工作日可用时间有限"],
  "ideas": ["用户原话：想尝试先调整活动比例"],
  "important_decisions": ["用户原话：暂不制定每日任务"]
}
